{
  "batch_id": "0b7a3c3e-5c55-4d52-9a57-7b2f3f0e4a11",
  "platform": "nexofolio-fetcher",
  "platform_version": "0.2.0",
  "target": {
    "project_id": "5b0f6a52-1c2d-4c8e-9f35-2a1d7c9e4b10",
    "environment": {
      "id": "8f2c1e7a-4b6d-4f1a-9c3e-6d5b2a1f0e98"
    },
    "site": {
      "origin": "https://shop.example.com",
      "prefix": "/"
    }
  },
  "records": [
    {
      "id": "5d1f0c2e-8a7b-4c3d-9e1f-0a2b3c4d5e6f",
      "kind": "http_exchange",
      "version": 1,
      "observed_at": "2026-09-24T08:00:00.123Z",
      "context": {
        "page_url": "https://shop.example.com/#/order/list",
        "page_title": "订单列表",
        "client_instance_id": "1e2d3c4b-5a69-4788-9a0b-1c2d3e4f5a6b",
        "page_id": "2f3e4d5c-6b7a-4899-8a0b-2c3d4e5f6a7b",
        "view_id": "3a4b5c6d-7e8f-4091-8a2b-3c4d5e6f7a8b",
        "interaction_id": "4b5c6d7e-8f90-4a1b-9c2d-4e5f6a7b8c9d",
        "seq": 42,
        "transport": "fetch",
        "frame": "page",
        "started_at": "2026-09-24T08:00:00.080Z",
        "completed_at": "2026-09-24T08:00:00.123Z"
      },
      "payload": {
        "request": {
          "method": "GET",
          "url": "https://shop.example.com/api/order/1001/items?page=1&size=20",
          "headers": {
            "state": "partial",
            "entries": [
              [
                "accept",
                "application/json"
              ],
              [
                "authorization",
                "Bearer eyJhbGciOiJIUzI1NiJ9.example"
              ]
            ]
          },
          "body": {
            "state": "none"
          }
        },
        "response": {
          "status": 200,
          "headers": {
            "state": "partial",
            "entries": [
              [
                "content-type",
                "application/json;charset=UTF-8"
              ]
            ]
          },
          "body": {
            "state": "full",
            "media_type": "application/json",
            "encoding": "utf8",
            "content": "{\"code\":0,\"data\":{\"total\":1,\"list\":[{\"sku\":\"KFR-35GW\",\"qty\":2,\"remark\":null}]}}",
            "bytes": 82
          }
        }
      }
    },
    {
      "id": "6e2a1d3f-9b8c-4d4e-8f2a-1b3c4d5e6f70",
      "kind": "http_exchange",
      "version": 1,
      "observed_at": "2026-09-24T08:00:05.000Z",
      "context": {
        "page_url": "https://shop.example.com/#/order/new",
        "seq": 43,
        "transport": "xhr",
        "frame": "page"
      },
      "payload": {
        "request": {
          "method": "POST",
          "url": "https://shop.example.com/api/order",
          "headers": {
            "state": "partial",
            "entries": [
              [
                "content-type",
                "application/json"
              ]
            ]
          },
          "body": {
            "state": "full",
            "media_type": "application/json",
            "encoding": "utf8",
            "content": "{\"customerId\":\"C-778\",\"items\":[]}"
          }
        },
        "response": {
          "status": 200,
          "body": {
            "state": "truncated",
            "media_type": "application/json",
            "encoding": "utf8",
            "content": "{\"code\":0,\"data\":{\"id\":\"O-2026",
            "bytes": 2097152
          }
        }
      }
    }
  ]
}
